{
  "schema": "echelon.release/v2",
  "systemId": "dokimos",
  "version": "0.9.0",
  "repository": "kemiller2002/dokimos",
  "tag": "dokimos-v0.9.0",
  "commit": "2dab315ba10c8eef652562ffa4543eee10942a51",
  "releaseStage": "stable",
  "lifecycleState": "active",
  "distributionClass": "self-contained-native-cli",
  "executable": "dokimos",
  "compatibilityAliases": [],
  "provides": [
    {
      "id": "quality.snapshot",
      "contractVersion": 2
    },
    {
      "id": "quality.compare",
      "contractVersion": 1
    },
    {
      "id": "quality.evaluate",
      "contractVersion": 1
    },
    {
      "id": "quality.history",
      "contractVersion": 1
    },
    {
      "id": "completion.verify",
      "contractVersion": 1
    },
    {
      "id": "completion.verify-attested",
      "contractVersion": 1
    },
    {
      "id": "evidence.reuse-plan",
      "contractVersion": 1
    },
    {
      "id": "evidence.provenance-record",
      "contractVersion": 1
    },
    {
      "id": "echelon.repository-lifecycle",
      "contractVersion": 1
    }
  ],
  "distributions": [
    {
      "mechanism": "github-release",
      "package": null,
      "url": "https://github.com/kemiller2002/dokimos/releases/tag/dokimos-v0.9.0"
    }
  ],
  "artifacts": [
    {
      "name": "dokimos-linux-x64.tar.gz",
      "purpose": "executable",
      "platform": "linux-x64",
      "sha256": "7131b09419e6da039fe32a31e86528cb43112769892f53ac54d8943be2e22069",
      "mediaType": "application/gzip"
    },
    {
      "name": "dokimos-linux-arm64.tar.gz",
      "purpose": "executable",
      "platform": "linux-arm64",
      "sha256": "1ee95af1da4fd28b53417d21da9dfd4431bb718df38a19eb09a4cf15321c51d3",
      "mediaType": "application/gzip"
    },
    {
      "name": "dokimos-linux-musl-x64.tar.gz",
      "purpose": "executable",
      "platform": "linux-musl-x64",
      "sha256": "73f250ea1a0d3fffd1e3b5bb638cb417490ddb84b9c0de9ef5a04c472715643b",
      "mediaType": "application/gzip"
    },
    {
      "name": "dokimos-osx-x64.tar.gz",
      "purpose": "executable",
      "platform": "osx-x64",
      "sha256": "03c055cab315b62f0bb5052b713792b8b148e55d2f01cb5bb5b9bc0ce62ffdcf",
      "mediaType": "application/gzip"
    },
    {
      "name": "dokimos-osx-arm64.tar.gz",
      "purpose": "executable",
      "platform": "osx-arm64",
      "sha256": "d8e3697c71f79006eff013a1822e981e0e10074d14a6de54b150c9cc281272ac",
      "mediaType": "application/gzip"
    },
    {
      "name": "dokimos-win-x64.zip",
      "purpose": "executable",
      "platform": "win-x64",
      "sha256": "0de4cc45a459ddb3ceb94a2af3c64a0e5731d87569b4980ed83283759a7cfa95",
      "mediaType": "application/zip"
    },
    {
      "name": "EchelonFoundry.Dokimos.Cli.0.9.0.nupkg",
      "purpose": "package",
      "platform": null,
      "sha256": "99404833dc42490afb696be07890f5eefe34c677d4ccdeff0ae67c75c34035e9",
      "mediaType": "application/zip"
    },
    {
      "name": "dokimos-checksums.txt",
      "purpose": "checksums",
      "platform": null,
      "sha256": "1a213297cc8555b14e26ccab221426cbbc1a76837a09e03d50374507b2f9c5dc",
      "mediaType": "text/plain"
    },
    {
      "name": "LICENSE",
      "purpose": "licenses",
      "platform": null,
      "sha256": "ffcca38841adb694b6f380647e15f17c446a4d1656fed51a1e2041d064c94cc8",
      "mediaType": "text/plain"
    }
  ],
  "evidence": {
    "licenses": {
      "artifactName": "LICENSE",
      "sha256": "ffcca38841adb694b6f380647e15f17c446a4d1656fed51a1e2041d064c94cc8"
    }
  }
}
