{
  "schema": "echelon.release/v2",
  "systemId": "ordo",
  "version": "1.17.0",
  "repository": "kemiller2002/ordo",
  "tag": "v1.17.0",
  "commit": "bb43c26c106f4cbe972234636c5c67edc235c188",
  "releaseStage": "stable",
  "lifecycleState": "active",
  "distributionClass": "self-contained-native-cli",
  "executable": "ordo",
  "compatibilityAliases": [
    "sde"
  ],
  "provides": [],
  "distributions": [
    {
      "mechanism": "github-release",
      "url": "https://github.com/kemiller2002/ordo/releases/tag/v1.17.0"
    }
  ],
  "artifacts": [
    {
      "name": "native-checksums.txt",
      "purpose": "checksums",
      "platform": null,
      "sha256": "01d55b4b897f729d025e8107a67e5d8d41e7aa9ed8a98bbe5954871df7911b11"
    },
    {
      "name": "ordo-construction.nupkg",
      "purpose": "package",
      "platform": null,
      "sha256": "4202083e5e45787b20741e69979e401298a55dac89148f6403e7200ba8a910f5"
    },
    {
      "name": "ordo-core.nupkg",
      "purpose": "package",
      "platform": null,
      "sha256": "056b0bc83cb67a88e996759f107665d7690bcb6668e43bac2d8d34862808b592"
    },
    {
      "name": "ordo-linux-arm64.tar.gz",
      "purpose": "executable",
      "platform": "linux-arm64",
      "sha256": "7e5ed469bc87d34ad8ffa4e6b4bcbbb1b6d4291dd690d344d0859843a688f5be"
    },
    {
      "name": "ordo-linux-musl-x64.tar.gz",
      "purpose": "executable",
      "platform": "linux-musl-x64",
      "sha256": "bf7734b32cc339f1d8f54f3889665fe56c66f60e22577f90c071b7fd27f3a98c"
    },
    {
      "name": "ordo-linux-x64.tar.gz",
      "purpose": "executable",
      "platform": "linux-x64",
      "sha256": "ab9437f5b4c72e86eaf1a25bfa7dc167e548be91ff9112df65bee678c5fb1b5d"
    },
    {
      "name": "ordo-osx-arm64.tar.gz",
      "purpose": "executable",
      "platform": "osx-arm64",
      "sha256": "7426f6f31e577ee61a842cec031405c51f9d6dbf58c39a1d59c8a41feedf3d2d"
    },
    {
      "name": "ordo-osx-x64.tar.gz",
      "purpose": "executable",
      "platform": "osx-x64",
      "sha256": "039bace97abb6f1fa7ef481f7ca99882ff4e67fa3e64ae8bfd3f8052e6fb4f32"
    },
    {
      "name": "ordo-win-x64.zip",
      "purpose": "executable",
      "platform": "win-x64",
      "sha256": "1d1dc950356e808f0663871ab9dcaba43c229cb05d7d31498f3ac5c0d38efc49"
    }
  ]
}
