{
  "schema": "echelon.release/v2",
  "systemId": "ordo",
  "version": "1.19.0",
  "repository": "kemiller2002/ordo",
  "tag": "v1.19.0",
  "commit": "1e8a95780813ed0520f9b0719b14e4052958ca20",
  "releaseStage": "stable",
  "lifecycleState": "active",
  "distributionClass": "self-contained-native-cli",
  "executable": "ordo",
  "compatibilityAliases": [
    "sde"
  ],
  "provides": [],
  "distributions": [
    {
      "mechanism": "github-release",
      "url": "https://github.com/kemiller2002/ordo/releases/tag/v1.19.0"
    }
  ],
  "artifacts": [
    {
      "name": "native-checksums.txt",
      "purpose": "checksums",
      "platform": null,
      "sha256": "ff4370e9b71869b6547c40cd467954f680b87bf027eaaf3831d88a5553513db7"
    },
    {
      "name": "ordo-construction.nupkg",
      "purpose": "package",
      "platform": null,
      "sha256": "4374520def14bc30f9c85f044569705681d3d992a703d41110fbe1097eef605a"
    },
    {
      "name": "ordo-core.nupkg",
      "purpose": "package",
      "platform": null,
      "sha256": "8ce9d8e428bc3b8708dbaa8afb3e82064c3a82d7dd63fc56db73b4453ec9de82"
    },
    {
      "name": "ordo-linux-arm64.tar.gz",
      "purpose": "executable",
      "platform": "linux-arm64",
      "sha256": "fdf8204c02393dc29c5aa1f528aefd4ef21cc943fb6b38317da0126a54c74510"
    },
    {
      "name": "ordo-linux-musl-x64.tar.gz",
      "purpose": "executable",
      "platform": "linux-musl-x64",
      "sha256": "4f390d703c0c73dc0e66f08e417f0f68ba37dc47690e39d862c47a69851092f6"
    },
    {
      "name": "ordo-linux-x64.tar.gz",
      "purpose": "executable",
      "platform": "linux-x64",
      "sha256": "2898e8541a2bc2836f3e1efee108f2b05594118b9ca1ecf4464a452c33aa4a36"
    },
    {
      "name": "ordo-osx-arm64.tar.gz",
      "purpose": "executable",
      "platform": "osx-arm64",
      "sha256": "30a4552c863ceeb099d0c00a18a9554c6396fd1807ac4e1a4c397b8978fa7b6a"
    },
    {
      "name": "ordo-osx-x64.tar.gz",
      "purpose": "executable",
      "platform": "osx-x64",
      "sha256": "ae6d6f20b71e20e5e9a74f35a463b6611dec501914cb3158af18bafcd1e34291"
    },
    {
      "name": "ordo-win-x64.zip",
      "purpose": "executable",
      "platform": "win-x64",
      "sha256": "144f7e9ad7df92ceaa69e4107418a1b593cdef6d668b25070b3b6c7d35c8ed3d"
    }
  ]
}
